{"candidate_execution_authorized":false,"changed_family_count":1,"changed_family_id":"process-lifecycle-delta","claim_authorized":false,"from":{"config_byte_count":26558,"config_bytes_sha256":"3742f632c7b5b18f8851d8ce198fe6eebd6ae6dbb1e3cf68a37633d67452f7bc","config_relative_path":"configs/executable-method-development-coverage-v7.json","coverage_sha256":"177a97767a528db74951a191282f6d719a34c8a136a21086940dfbd92e5bb569","coverage_version":"7.0.0","git_commit":"199eba7759cf49215a4e1da09dc59d2c175ee41f"},"migration_sha256":"31ce6e0a45f49bc6c31208f3429666aa5d713b78d2186ab7ef228ed768f8e5ff","migration_version":"1.0.0","model_selection_eligible":false,"new_family_sha256":"f5ef27ca10caedbad1e6e3652e6020c12524309698970438946969cf89310510","new_lifecycle_state":"integrated","new_source_registry_commitment":{"added_task_count":20,"cumulative_suite_sha256":"fce6939985a541c0bdb0e9f456b0e713f835b283a001e8a0f124047abe6ad99a","cumulative_task_count":480,"registry_sha256":"2d2773bcab7f83c99638541803516d893d3749b6c7b1b0091c6633f1c54493a5","tranche_id":"fifteenth-tranche"},"old_family_sha256":"b7f590855836e878258829209e707f3b1b4c00bdc22d6352c65ce3e7f4f88c46","old_lifecycle_state":"planned","preserved_allowed_tools":["awk","comm","jq","mkdir","sort"],"preserved_capability_tags":["process-state","structured-output","temporal-diff","unix-concepts"],"preserved_filesystem_schema":"paired-process-state-snapshots","preserved_output_contract":"pid-lifecycle-transition-report","preserved_parameter_axes":[{"axis_name":"snapshot_pair","values":["status-only","status-and-cmdline","status-and-cgroups","complete-synthetic-proc"]},{"axis_name":"selection_policy","values":["all-changes","starts-only","exits-only","state-changes","resource-threshold-crossings"]}],"preserved_promotion_history":[{"discrimination_sha256":"ae95eef5802c010e70e338d257f5d0f3d01a39fa5cf471f945a8b75f554faa21","family_id":"compressed-archive-roundtrip-verify","new_lifecycle_state":"integrated","old_lifecycle_state":"planned","source_tranche_id":"tenth-tranche","task_set_sha256":"450ba507f0672e3a47ca6d495a6553d07294c605f94b3c5f03aa111d42bf771a"},{"discrimination_sha256":"f71ba70f0a4d004bed235e897a73c1222c6d2687e4eeb842c008f7878e9457aa","family_id":"checksum-repair-plan","new_lifecycle_state":"integrated","old_lifecycle_state":"planned","source_tranche_id":"eleventh-tranche","task_set_sha256":"e52fb74ece2a94baa9bd1b2f6da25ca103839e1e9666361fe5406c34a36b9bb0"},{"discrimination_sha256":"732c1438a4337d2043ee85e2eb4e9e7c437a0051eb1a828cdac6139845db0e94","family_id":"jsonl-csv-enrichment-compose","new_lifecycle_state":"integrated","old_lifecycle_state":"planned","source_tranche_id":"twelfth-tranche","task_set_sha256":"60a8ab6770bae6de43d430db9e3edf136f28f0a0ad2dacfd09b627ce19cf75c3"},{"discrimination_sha256":"416907543c373f36e55098c514fbe17aeef0192d9e5dc43cd025bed809a0ad42","family_id":"nested-json-schema-migration","new_lifecycle_state":"integrated","old_lifecycle_state":"planned","source_tranche_id":"thirteenth-tranche","task_set_sha256":"2ab692e66a3090b5d05a204b18f4fdb99ddc822cdbaa5b7912b7ac2166680e0b"},{"discrimination_sha256":"25c9f68985ed918a6e8fe9d36b4b6d8a9bd34bb2cd9b039dff82a9276658c82c","family_id":"dependency-dag-execution-plan","new_lifecycle_state":"integrated","old_lifecycle_state":"planned","source_tranche_id":"fourteenth-tranche","task_set_sha256":"57860e84d15ba33575b12b365f1f541b2537051a12e45f3ca470f1d14819c279"}],"preserved_solution_track":"bash-native","promotion_evidence":{"discrimination_sha256":"1a94ccdd0d75698973f172daa5a90e660747718969b05f0d6b414ac934c7e383","family_id":"process-lifecycle-delta","new_lifecycle_state":"integrated","old_lifecycle_state":"planned","source_tranche_id":"fifteenth-tranche","task_set_sha256":"2add107b1b16270837968e477662f721faef4ea32b4432b5efe41c5af8097d4d"},"public_method_development":true,"reason_codes":["planned-contract-preserved","canonical-grid-integration","process-lifecycle-delta-discrimination","fifteenth-tranche-integration","prior-promotion-history-preserved"],"record_type":"cbds.executable-method-development-coverage-v7-to-v8-migration","schema_version":"1.0.0","scored":false,"scored_evaluation_authorized":false,"sealed":false,"to":{"config_relative_path":"configs/executable-method-development-coverage-v8.json","coverage_sha256":"606ba0a90adc8f19cafd7495ab24ff117f31edb653b4b3cf8b6917a14b70ad05","coverage_version":"8.0.0"},"unchanged_family_count":24,"unchanged_family_sha256":["ee5c8d54a558bf363551c1be6fe890516ec771125dacea18a3a6a02e69c74883","eedccb0e40222cb86fa56dd0afdbe8fbc13c68f1e91ab9d0c14133da394249aa","26fb05b0647db40ad03a87bed6872fa1e5c0cf62bb512fb0413b19294e5d0270","1929ab3d395d5919782444c6f821edf6e7728169fdeb1418d8d46f7e94db8ad5","fe784471ec4f71b6f90f7e69ba19c1d4dfa1323a1ba33e15221f71198dd447f9","72857e1eb6c7b6b5f38b861d032fc926b3c37c6e4b64359f72efa07a247aa647","778508feae91eafcc6b7e7d0e80d3c8f13213310b6a0ac878f07e11d577a7304","ef617cabdae067df2c1af55172d6984239658ff8adf90b98b3caf9ba6f3c5f82","f623d663732550cdd36c8f72faf8f7c87d30eb1c3949595371b2570eef46b322","539fd216fe143776a5e07681a8f8a5331ca6ba5aca472779abc7693f226f8578","6f6c2e9c86b65f230694af38803a4b81a4d5bceb88079f1418144b69a3a0b7a1","d7b12323e97ecc07544bd913008157e0d965cb97df5a845db4b404f1220cebd0","0996f74065c1a6b0d567099cb6d8e0a2622f73c962ed7ae64583f31e111fc042","ece3f2b9da802cea801dc9272695f7dc82bf4901c8b2c4da5eabfbf4562b7fb8","6763260f60cc7b9cd92559dd2db9f17c39a7b51a2f59dcec3747622edbb73941","7d1fd358167f58131e86548a53e30e49f17d7ef4a12d2ac7aeccab961ee0200a","97629e67865cb4e2275f64dfd56ffc85b9eb51bff79c3508595c9ce3166e4f99","e5220935eae1a67271733903252629df7b71a3fb01cc116ad9d86ce5e12738cc","971ed53000934f78f8d16e9842112d98c9c08a3abe18d999a88bd71b7dd1a1aa","3541ee226666eb2fa69182980571ec6d315267d4bb9166bb247d6740050221bb","f6865c02a7386e85e4abd1ddbfb4dc615dd016cd3738452913d0e49e6476f49d","cee48b9413a501b7976d713e878cd4ca4a621cbb568242e6b82e2678da530fc4","142c53602d616c44de495a65d71797d08752d874d0243bec1f75b4e436286ae5","daa5a4e0018acdfe6da7ac684574f735313cc14daf1617fd95226f847c133959"]}
